{
  "spec_version": "sqljudge.pack/v1",
  "id": "postgresql-cte-junior-middle-20",
  "version": "1.0.0",
  "title": "PostgreSQL CTE Mastery — 20 Labs (Junior to Middle)",
  "dialect": "postgresql",
  "min_engine_version": "15",
  "schema": ["schema/001_tables.sql"],
  "problems": [
    "problems/eligible-task-filter/problem.json",
    "problems/above-project-average/problem.json",
    "problems/project-status-summary/problem.json",
    "problems/projects-above-average-count/problem.json",
    "problems/users-multiple-active-tasks/problem.json",
    "problems/projects-without-completions/problem.json",
    "problems/task-capacity/problem.json",
    "problems/largest-estimate-per-project/problem.json",
    "problems/latest-assignment-per-user/problem.json",
    "problems/second-newest-task/problem.json",
    "problems/daily-running-hours/problem.json",
    "problems/monthly-net-cashflow/problem.json",
    "problems/project-estimate-overrun/problem.json",
    "problems/import-dedup-winner/problem.json",
    "problems/import-quality-report/problem.json",
    "problems/project-hours-leaderboard/problem.json",
    "problems/user-work-inactivity-gaps/problem.json",
    "problems/task-forest-depths/problem.json",
    "problems/descendant-effort-per-root/problem.json",
    "problems/next-assignable-task/problem.json"
  ]
}
